[
  {
    "case_id": "EX-001",
    "family_id": "fam_halconeo_01",
    "parent_id": null,
    "source_id": "src_training_s04",
    "source_type": "synthetic_authored",
    "license_or_permission_ref": "sentinel_internal_training_v1",
    "allowed_uses": ["training", "validation"],
    "collected_at": "2026-09-28",
    "region_declared": "general_mexico",
    "synthetic": true,
    "split_suggestion": "train",
    "annotation_version": "v1.0",
    "review_status": "double_reviewed_consensus",
    "reviewers": ["rev_0401", "rev_0402"],
    "label": "RISK",
    "behavior_targets": ["surveillance_halconeo"],
    "annotator_confidence": "high",
    "first_signal_turn": 1,
    "critical_event_turn": 3,
    "annotation_notes": "Adulto ofrece recarga telefónica y dinero a cambio de avisar cuándo pasan patrullas por la esquina de la secundaria.",
    "discrepancy_log": null,
    "turns": [
      { "turn_index": 0, "sender_id": "u_adult", "role": "potential_perpetrator", "text": "Qué onda chavo, te vi saliendo de la secundaria.", "signals": [] },
      { "turn_index": 1, "sender_id": "u_adult", "role": "potential_perpetrator", "text": "Te pongo 200 de saldo si me tiras un paro desde tu ventana.", "signals": ["economic_offer", "surveillance_task"] },
      { "turn_index": 2, "sender_id": "u_minor", "role": "target_minor", "text": "Qué tipo de paro o qué?", "signals": [] },
      { "turn_index": 3, "sender_id": "u_adult", "role": "potential_perpetrator", "text": "Nomás mándame un mensaje cada que veas pasar las camionetas de la estatal.", "signals": ["surveillance_task", "police_monitoring"] }
    ]
  },
  {
    "case_id": "EX-002",
    "family_id": "fam_gaming_01",
    "parent_id": null,
    "source_id": "src_training_s04",
    "source_type": "synthetic_authored",
    "license_or_permission_ref": "sentinel_internal_training_v1",
    "allowed_uses": ["training", "validation"],
    "collected_at": "2026-09-28",
    "region_declared": "general_mexico",
    "synthetic": true,
    "split_suggestion": "train",
    "annotation_version": "v1.0",
    "review_status": "double_reviewed_consensus",
    "reviewers": ["rev_0401", "rev_0402"],
    "label": "BENIGN",
    "behavior_targets": ["gaming_trading_benign", "cultural_slang_benign"],
    "annotator_confidence": "high",
    "first_signal_turn": null,
    "critical_event_turn": null,
    "annotation_notes": "Uso de palabras sensibles ('armas', 'bisne', 'matar') en contexto evidente de videojuego en línea entre compañeros de clase.",
    "discrepancy_log": null,
    "turns": [
      { "turn_index": 0, "sender_id": "p1", "role": "bystander_peer", "text": "Te cambio la skin legendaria por el arma dorada, qué dices?", "signals": ["gaming_lexicon"] },
      { "turn_index": 1, "sender_id": "p2", "role": "bystander_peer", "text": "Simón, buen bisne, vámonos a lootear a la zona roja.", "signals": ["gaming_lexicon", "slang_bisne"] },
      { "turn_index": 2, "sender_id": "p1", "role": "bystander_peer", "text": "Jálate al lobby que nos van a matar bien rápido.", "signals": ["gaming_lexicon"] }
    ]
  },
  {
    "case_id": "EX-003",
    "family_id": "fam_narcoculture_01",
    "parent_id": null,
    "source_id": "src_training_s04",
    "source_type": "synthetic_authored",
    "license_or_permission_ref": "sentinel_internal_training_v1",
    "allowed_uses": ["training", "validation"],
    "collected_at": "2026-09-28",
    "region_declared": "general_mexico",
    "synthetic": true,
    "split_suggestion": "train",
    "annotation_version": "v1.0",
    "review_status": "double_reviewed_consensus",
    "reviewers": ["rev_0401", "rev_0403"],
    "label": "BENIGN",
    "behavior_targets": ["narcoculture_media_benign"],
    "annotator_confidence": "high",
    "first_signal_turn": null,
    "critical_event_turn": null,
    "annotation_notes": "Mención de términos de narcocultura (patrón, plaza, troca) citando la letra de una canción popular y una serie de streaming.",
    "discrepancy_log": null,
    "turns": [
      { "turn_index": 0, "sender_id": "m1", "role": "bystander_peer", "text": "Ya viste el nuevo capítulo de la serie de los capos en Netflix?", "signals": ["media_reference"] },
      { "turn_index": 1, "sender_id": "m2", "role": "bystander_peer", "text": "Sí, la rola que sale al final cuando andan en la troca blindada está perrísima.", "signals": ["music_reference", "slang_troca"] }
    ]
  },
  {
    "case_id": "EX-004",
    "family_id": "fam_transport_01",
    "parent_id": null,
    "source_id": "src_training_s04",
    "source_type": "synthetic_authored",
    "license_or_permission_ref": "sentinel_internal_training_v1",
    "allowed_uses": ["training", "validation"],
    "collected_at": "2026-09-28",
    "region_declared": "general_mexico",
    "synthetic": true,
    "split_suggestion": "train",
    "annotation_version": "v1.0",
    "review_status": "double_reviewed_consensus",
    "reviewers": ["rev_0402", "rev_0403"],
    "label": "RISK",
    "behavior_targets": ["illicit_transport_mula"],
    "annotator_confidence": "high",
    "first_signal_turn": 1,
    "critical_event_turn": 2,
    "annotation_notes": "Solicitud de traslado de paquete cerrado con orden explícita de no abrir ni hacer preguntas a cambio de pago en efectivo.",
    "discrepancy_log": null,
    "turns": [
      { "turn_index": 0, "sender_id": "recruiter", "role": "potential_perpetrator", "text": "Necesito que lleves una mochila cerrada al metro Taxqueña.", "signals": ["logistics_task"] },
      { "turn_index": 1, "sender_id": "recruiter", "role": "potential_perpetrator", "text": "Te doy 1,500 en la mano, nomás ni se te ocurra abrirla ni preguntar qué trae.", "signals": ["high_payment_minor", "enforced_secrecy"] },
      { "turn_index": 2, "sender_id": "target", "role": "target_minor", "text": "Está bien, voy saliendo.", "signals": ["compliance"] }
    ]
  },
  {
    "case_id": "EX-005",
    "family_id": "fam_errand_01",
    "parent_id": null,
    "source_id": "src_training_s04",
    "source_type": "synthetic_authored",
    "license_or_permission_ref": "sentinel_internal_training_v1",
    "allowed_uses": ["training", "validation"],
    "collected_at": "2026-09-28",
    "region_declared": "general_mexico",
    "synthetic": true,
    "split_suggestion": "train",
    "annotation_version": "v1.0",
    "review_status": "double_reviewed_consensus",
    "reviewers": ["rev_0401", "rev_0402"],
    "label": "BENIGN",
    "behavior_targets": ["none_benign"],
    "annotator_confidence": "high",
    "first_signal_turn": null,
    "critical_event_turn": null,
    "annotation_notes": "Mandado cotidiano de compra de despensa escolar con supervisión y mención de padres.",
    "discrepancy_log": null,
    "turns": [
      { "turn_index": 0, "sender_id": "bro1", "role": "bystander_peer", "text": "Oye, me prestas 50 pesos para la cartulina de la papelería?", "signals": [] },
      { "turn_index": 1, "sender_id": "bro2", "role": "bystander_peer", "text": "Sí, me dijo mi mamá que te los diera de lo del cambio de las tortillas.", "signals": ["parent_supervision"] }
    ]
  },
  {
    "case_id": "EX-006",
    "family_id": "fam_ambiguous_01",
    "parent_id": null,
    "source_id": "src_training_s04",
    "source_type": "synthetic_authored",
    "license_or_permission_ref": "sentinel_internal_training_v1",
    "allowed_uses": ["training", "validation"],
    "collected_at": "2026-09-28",
    "region_declared": "general_mexico",
    "synthetic": true,
    "split_suggestion": "train",
    "annotation_version": "v1.0",
    "review_status": "double_reviewed_consensus",
    "reviewers": ["rev_0401", "rev_0403"],
    "label": "INSUFFICIENT_CONTEXT",
    "behavior_targets": ["ambiguous_errand_unclear"],
    "annotator_confidence": "medium",
    "first_signal_turn": null,
    "critical_event_turn": null,
    "annotation_notes": "Conversación fragmentada. Hay un encargo no especificado que podría ser un favor lícito entre vecinos o una prueba preliminar, imposible determinar sin más turnos.",
    "discrepancy_log": null,
    "turns": [
      { "turn_index": 0, "sender_id": "u1", "role": "unknown", "text": "Pasa al rato por la casa.", "signals": [] },
      { "turn_index": 1, "sender_id": "u1", "role": "unknown", "text": "Te tengo un encargo listo.", "signals": ["unspecified_errand"] }
    ]
  },
  {
    "case_id": "EX-007",
    "family_id": "fam_debt_01",
    "parent_id": null,
    "source_id": "src_training_s04",
    "source_type": "synthetic_authored",
    "license_or_permission_ref": "sentinel_internal_training_v1",
    "allowed_uses": ["training", "validation"],
    "collected_at": "2026-09-28",
    "region_declared": "general_mexico",
    "synthetic": true,
    "split_suggestion": "train",
    "annotation_version": "v1.0",
    "review_status": "double_reviewed_consensus",
    "reviewers": ["rev_0402", "rev_0403"],
    "label": "RISK",
    "behavior_targets": ["coercive_debt_bonding"],
    "annotator_confidence": "high",
    "first_signal_turn": 1,
    "critical_event_turn": 3,
    "annotation_notes": "Uso de deuda por juego/dinero previo para forzar al menor a realizar una entrega bajo amenaza de cobrar a su familia.",
    "discrepancy_log": null,
    "turns": [
      { "turn_index": 0, "sender_id": "aggressor", "role": "potential_perpetrator", "text": "Ya pasaron dos semanas de la lana que perdiste en las apuestas.", "signals": ["debt_pressure"] },
      { "turn_index": 1, "sender_id": "victim", "role": "target_minor", "text": "Por favor aguántame, no tengo cómo pagarte ahorita.", "signals": ["vulnerability"] },
      { "turn_index": 2, "sender_id": "aggressor", "role": "potential_perpetrator", "text": "O me pagas hoy o voy a buscar a tus papás.", "signals": ["family_threat"] },
      { "turn_index": 3, "sender_id": "aggressor", "role": "potential_perpetrator", "text": "La única forma de limpiar la cuenta es que vayas a entregar este sobre al taller.", "signals": ["coercive_task_substitution"] }
    ]
  },
  {
    "case_id": "EX-008",